### ISSUE TITLE
Weird tcpdump output when capturing on SIIT interface

### ISSUE THREAD

**Issue by toreanderson** [ydahhrk/joolif#5]
I'm not entirely sure if this is a bug in joolif, in tcpdump, or just some costmetic oddity. But I'll report it here anyway. When sending traffic through the translator, it would appear that tcpdump is unable to decode the translated packets as IPv6:

```
ubuntu@ubuntu-20:~$ sudo tcpdump -ni siit0
tcpdump: verbose output suppressed, use -v[v]... for full protocol decode
listening on siit0, link-type EN10MB (Ethernet), snapshot length 262144 bytes
11:03:47.213870 IP 192.0.2.1 > 1.1.1.1: ICMP echo request, id 2272, seq 136, length 64
11:03:47.213903 3a:3f:20:01:06:7c > 60:00:00:00:00:40, ethertype Unknown (0x2960), length 104: 
	0x0000:  6464 0000 0000 c000 0201 2001 067c 2960  dd...........|)`
	0x0010:  6464 0000 0000 0101 0101 8000 6a69 08e0  dd..........ji..
	0x0020:  0088 13af b967 0000 0000 5043 0300 0000  .....g....PC....
	0x0030:  0000 1011 1213 1415 1617 1819 1a1b 1c1d  ................
	0x0040:  1e1f 2021 2223 2425 2627 2829 2a2b 2c2d  ...!"#$%&'()*+,-
	0x0050:  2e2f 3031 3233 3435 3637                 ./01234567
```

However, if tcpdump is using `-i any`, it seems correct (and the translated packets are forwarded out the WAN interface `ens3`, as expected). So it works, it just looks weird and is perhaps a bit hard to debug when tcpdump is acting strange.

```
ubuntu@ubuntu-20:~$ sudo tcpdump -ni any
tcpdump: data link type LINUX_SLL2
tcpdump: verbose output suppressed, use -v[v]... for full protocol decode
listening on any, link-type LINUX_SLL2 (Linux cooked v2), snapshot length 262144 bytes
11:05:24.493815 siit0 Out IP 192.0.2.1 > 1.1.1.1: ICMP echo request, id 2272, seq 231, length 64
11:05:24.493832 siit0 In  IP6 2001:67c:2960:6464::c000:201 > 2001:67c:2960:6464::101:101: ICMP6, echo request, id 2272, seq 231, length 64
11:05:24.493843 ens3  Out IP6 2001:67c:2960:6464::c000:201 > 2001:67c:2960:6464::101:101: ICMP6, echo request, id 2272, seq 231, length 64
```

joolif was set up like so:

```
insmod mod/joolif.ko
ip link add up name siit0 type siit
ip -4 address add 192.0.2.1/32 dev siit0
ip -4 route add default dev siit0
usr/joolif siit0 pool6 2001:67c:2960:6464::/96
```
